{
  "$schema": "https://json-schema.org/draft/2020-12/schema",
  "$id": "napoleon-remastered/schemas/jobs.schema.json",
  "title": "Jobs",
  "description": "The job queue (D16). One row per job; the brief, report and review live in jobs/<id>/. A job in progress is a remote branch job/<id>; `done` on main means reviewed and merged. Rules for picking up and reviewing: CLAUDE.md, Jobs.",
  "type": "object",
  "required": ["id", "description", "title", "phase", "status", "model", "needs_pc", "depends_on"],
  "additionalProperties": false,
  "properties": {
    "id": {"type": "string", "pattern": "^J[1-9][0-9]*$"},
    "description": {"type": "string", "minLength": 1, "description": "the scope in one or two lines (what a brief must cover)"},
    "title": {"type": "string", "minLength": 1},
    "phase": {"type": "integer", "minimum": 0, "maximum": 6},
    "status": {"enum": ["needs_brief", "queued", "review", "done", "blocked"]},
    "model": {"enum": ["sonnet", "opus"], "description": "opus only with the reason in the brief (D15)"},
    "needs_pc": {"type": "boolean"},
    "depends_on": {"type": "array", "uniqueItems": true, "items": {"type": "string", "x-ref": "jobs"}},
    "brief": {"type": "string", "pattern": "^jobs/J[0-9]+/brief\\.md$"},
    "report": {"type": "string", "pattern": "^jobs/J[0-9]+/report\\.md$"},
    "review": {"type": "string", "pattern": "^jobs/J[0-9]+/review\\.md$"},
    "blocked_by": {"type": "string", "minLength": 1, "description": "why, when status is blocked"}
  },
  "allOf": [
    {"if": {"properties": {"status": {"enum": ["queued", "review", "done"]}}}, "then": {"required": ["brief"]}},
    {"if": {"properties": {"status": {"enum": ["review", "done"]}}}, "then": {"required": ["report"]}},
    {"if": {"properties": {"status": {"const": "done"}}}, "then": {"required": ["review"]}},
    {"if": {"properties": {"status": {"const": "blocked"}}}, "then": {"required": ["blocked_by"]}}
  ],
  "x-view": {"title": "Jobs", "columns": ["id", "status", "title", "phase", "model", "needs_pc", "depends_on", "brief", "report", "review"]}
}
